{
  "id": "wpengine",
  "name": "WP Engine",
  "slug": "wpengine",
  "website_url": "https://wpengine.com/plans",
  "provider_type": "managed-wordpress",
  "status": "active",
  "founded_year": 2010,
  "headquarters_country": "United States",
  "review_url": null,
  "description": "Managed WordPress platform with visit-based capacity tiers, backups, security tooling, CDN, staging, and WordPress support.",
  "verification": {
    "status": "verified",
    "last_verified_at": "2026-09-09",
    "source_ids": [
      "wpengine-wordpress-pricing-2026-09-09"
    ]
  }
}
