{
  "id": "vultr",
  "name": "Vultr",
  "slug": "vultr",
  "website_url": "https://www.vultr.com/products/cloud-compute/",
  "provider_type": "cloud",
  "status": "active",
  "founded_year": 2014,
  "headquarters_country": "United States",
  "review_url": "/reviews/vultr/",
  "description": "Cloud compute platform focused on flexible deployment, hourly billing, and a broad location footprint.",
  "verification": {
    "status": "verified",
    "last_verified_at": "2026-09-09",
    "source_ids": [
      "vultr-pricing-official-2026-09-09",
      "vultr-plans-api-2026-09-09",
      "vultr-billing-docs-2026-09-09"
    ]
  }
}
